{
  "n_runs": 3,
  "n_completed": 2,
  "citability": {
    "n_eligible": 2,
    "n_citable": 1,
    "n_blocked": 1,
    "n_ungated": 0,
    "note": "1/2 eligible trials are citable; 1 blocked by the process gate"
  },
  "by_harness_model_mean_reward": {
    "cc / example-model": 0.5
  },
  "by_harness_model_mean_reward_all_eligible": {
    "cc / example-model": 0.25
  },
  "by_harness_model_census": {
    "cc / example-model": {
      "n_eligible": 2,
      "n_citable": 1,
      "n_blocked": 1,
      "n_ungated": 0
    }
  },
  "n_eligible_completed": 2,
  "by_harness_model_mean_answer": {
    "cc / example-model": 0.5
  },
  "by_harness_model_mean_process": {
    "cc / example-model": 1.0
  },
  "by_harness_model_mean_capability_coverage": {
    "cc / example-model": 1.0
  },
  "by_harness_model_mean_mcp_success": {},
  "by_harness_model_citable_rate": {
    "cc / example-model": 0.5
  },
  "by_harness_domain_mean_reward": {
    "cc / architecture": 0.5
  },
  "by_harness_domain_mean_reward_all_eligible": {
    "cc / architecture": 0.25
  },
  "rows": [
    {
      "task_id": "example-001",
      "set": "synthetic-example",
      "domain": "architecture",
      "v_class": "V1",
      "harness": "cc",
      "model": "example-model",
      "status": "ok",
      "evaluation_eligible": true,
      "reward": 0.5,
      "answer_score": 0.5,
      "process_compliance": 1.0,
      "shadow_llm_judge": null,
      "shadow_process_judge": null,
      "capability_policy": 1.0,
      "capability_coverage": 1.0,
      "mcp_attempted": 0.0,
      "mcp_success_rate": 0.0,
      "citable": true,
      "blockers": []
    },
    {
      "task_id": "example-002",
      "set": "synthetic-example",
      "domain": "architecture",
      "v_class": "V1",
      "harness": "cc",
      "model": "example-model",
      "status": "ok",
      "evaluation_eligible": true,
      "reward": 0.0,
      "answer_score": 0.0,
      "process_compliance": 0.0,
      "shadow_llm_judge": null,
      "shadow_process_judge": null,
      "capability_policy": 0.0,
      "capability_coverage": 1.0,
      "mcp_attempted": 0.0,
      "mcp_success_rate": 0.0,
      "citable": false,
      "blockers": [
        "synthetic_policy_blocker"
      ]
    },
    {
      "task_id": "example-003",
      "set": "synthetic-example",
      "domain": "architecture",
      "v_class": "V1",
      "harness": "cc",
      "model": "example-model",
      "status": "error",
      "evaluation_eligible": true,
      "reward": null,
      "answer_score": null,
      "process_compliance": null,
      "shadow_llm_judge": null,
      "shadow_process_judge": null,
      "capability_policy": null,
      "capability_coverage": null,
      "mcp_attempted": null,
      "mcp_success_rate": null,
      "citable": null,
      "blockers": []
    }
  ]
}